{
    "$schema": "./hwd_conf.schema.json",
    "transformation": "Linear",
    "column_linearity": "elastic",
    "column_pins": "3",
    "column_capbeam_joint": "none",
    "abutment_model": "linear",
    "hinge_model": "linear",
    "Ec": 3530.5,
    "Ecol": 3530.5,
    "Es": 29000.0,
    "CGa": 50.0,
    "CGh": 60.0
}